title,genre,description
The Matrix,Sci-Fi,Action-packed journey through a simulated reality.
The Godfather,Crime,Classic mafia story about power and family.
Inception,Sci-Fi,Mind-bending thriller about dreams within dreams.
Titanic,Romance,A tragic love story set on the ill-fated ship.
Interstellar,Sci-Fi,An epic voyage through space to save humanity.
Avatar,Sci-Fi,A story about a human-alien hybrid in a beautiful alien world.
Pulp Fiction,Crime,A non-linear story about crime and redemption.
Gladiator,Action,A tale of betrayal and revenge set in ancient Rome.